{
  "schema_version": 8,
  "id": "frozen-peaks-ridge",
  "name": "Knife-Edge Ridge",
  "description": "A razor-thin ridge of wind-scoured rock and ice runs north, sheer drops falling away to either side into cloud. Rime coats every surface in feathered white, and the footing is glazed and unforgiving. Ahead the ridge widens toward a broad, exposed summit crowned with shattered ice.",
  "item_ids": [],
  "exits": {
    "south": "frozen-peaks-glacier",
    "north": "frozen-peaks-summit"
  },
  "min_level": 18,
  "is_outdoor": true,
  "ambient_messages": [
    "The wind gusts hard enough to stagger you, then falls to a sudden, watchful stillness.",
    "Feathers of rime break from the rocks and spin away into the void below.",
    "Far beneath the ridge, cloud churns and boils, hiding whatever waits at the bottom."
  ]
}
